{
  "schema_version": "evidence_freeze_v1",
  "run_id": "he_full",
  "freeze_id": "freeze_0001",
  "frozen_at": "2026-05-10T07:45:37.672327+00:00",
  "evidence_index_path": "evidence_index.json",
  "evidence_index_sha256": "ad1672184b49e5586df6673921267f2c629a271ff838fe9a3dacc889070013af",
  "policy_decision_path": "policy_decision.json",
  "policy_decision_sha256": "b31e99ee9be002b055d4d711556dd745f6da6d0425ad028b83175dca8d608d4a",
  "hash_manifest_path": "evidence_hash_manifest.json",
  "item_count": 6
}
