{
  "schema_version": "evidence_freeze_v1",
  "run_id": "orchtest",
  "freeze_id": "freeze_0001",
  "frozen_at": "2026-05-10T09:39:58.412579+00:00",
  "evidence_index_path": "evidence_index.json",
  "evidence_index_sha256": "1f1a7d0c8bf16d1963dd61f576a1d312ca3c9f8393601fac4043bbb17bde2fbe",
  "policy_decision_path": "policy_decision.json",
  "policy_decision_sha256": "99f1e88478db12a3c03f58d00f605ea24dabcc7d356d864b503252e5711a2b97",
  "hash_manifest_path": "evidence_hash_manifest.json",
  "item_count": 11
}
