{
  "schema_version": "evidence_freeze_v1",
  "run_id": "fixtest",
  "freeze_id": "freeze_0001",
  "frozen_at": "2026-05-10T09:19:38.770795+00:00",
  "evidence_index_path": "evidence_index.json",
  "evidence_index_sha256": "57ab3393d57a3ed02a6155e315bb24fa0d423df1c1cc2e4ed6bcdc18d15a34c1",
  "policy_decision_path": "policy_decision.json",
  "policy_decision_sha256": "ba8335d22e1e57c334c7cb70b636f27d546dc13cba787ad185b47c3f3b492ed2",
  "hash_manifest_path": "evidence_hash_manifest.json",
  "item_count": 11
}
